id,name,type,website,description,location_city,location_country,location_greater_stockholm,logo_url,owner,maturity,accepts_interns,is_swedish,source,metadata_source_url,data_quality_score,last_updated,sectors,domains,ai_capabilities,dimensions
1125,Google Digitalakademin,corporation,https://learndigital.withgoogle.com/digitalakademin,,,Sweden,,https://aihubtest-bucket.s3.eu-north-1.amazonaws.com/public/storage/images/47/4nspCB3DEvqrR9Y8zZi5jhY72SddFpoN9pKfA7bS.png,Google,,,1,my.ai.se,,50,2025-10-15 16:50:01,,,,Competence & Expertise
1126,National Space Data Lab,lab,,,,Sweden,,https://aihubtest-bucket.s3.eu-north-1.amazonaws.com/public/storage/images/48/k4NOBazI8CU45WCtIoPys1rYdnDZn5gnKxicjeHu.jpg,AI Sweden,,,1,my.ai.se,,40,2025-10-15 16:50:01,Space,,,
1130,RISE,publicsector,https://www.ri.se/sv,,,Sweden,,https://aihubtest-bucket.s3.eu-north-1.amazonaws.com/public/storage/images/52/vlDoP9YTeKQcQvtLD8OJrHp6dDLI77lZhUtSYtAU.png,,,,1,my.ai.se,,50,2025-10-15 16:50:01,,Research & Development,,
1131,Centre for Distance-spanning Technologies,academia,https://www.ltu.se/centres/cdt?l=en,"From projects to business CDT is a research, design and innovation joint venture between the core partners Luleå University of Technology, and the IT industry. CDT offers an integrated environment of people, infrastructure, tools, processes and services for research, development and test of new and emerging distance-spanning technologies and its applications. A main mission of CDT is to run business innovation projects, i.e. projects which bring knowledge based innovation into sustainable new business. A CDT project starts when an idea (based on new knowledge from research) has been evaluated to have a significant business opportunity. The idea may be based on any combination or blend of new technology, identified needs, new business principle or emerging market opportunity. Are good business innovations driven by needs or emerging technology – arguments are eternal. At CDT we are fine whatever comes first. For certain, it is important that they both are present and can match! Towards new solutions During a CDT business innovation project, key assets are created such as architectures, new technology, methods as well as analysis of needs, market and usability aspects. If successful, the project final delivery is a product/service prototype and a business concept (perceived market, business model and suitable value chain). Normally, final delivery also includes IPR settlement with a ”commercial host” and other necessary preparations for a business exploitation process to ”take over”. PartnersCDT has two partners, Ericsson and Skellefteå municipality. YouTubeCDT has a YouTube channel what can be found here:https://www.youtube.com/channel/UC8Qt5Si4x-BR8K_OOMKsX3w/",,Sweden,,https://aihubtest-bucket.s3.eu-north-1.amazonaws.com/public/storage/images/4788/logo_CDT_2022.jpg,,,,1,my.ai.se,,85,2025-10-15 16:50:01,"Information Technology, Space, Telecommunications",Research & Development,,Competence & Expertise
1132,AI Agendan,network,https://www.ri.se/sv/ai-agendan,"Sverige har en god position för att både tillgodogöra sig och driva på AI-utveckling, och genom strategiska satsningar, samordning och samsyn kan samhällseffekten bli betydande. AI-agendan för Sverige presenterar förslag som syftar till att accelerera de positiva effekterna av AI-användningen i det svenska samhället på kort och lång sikt, samtidigt som riskerna minimeras utifrån visionen att Sverige skall vara ledande i att ta tillvara möjligheterna på ett ansvarsfullt, inkluderande, och hållbart sätt. Vi avser att kontinuerligt utveckla denna AI-agenda och fortsätta att bredda deltagandet.",,Sweden,,https://aihubtest-bucket.s3.eu-north-1.amazonaws.com/public/storage/images/53/iTyz1kttnDt2BGE1AJS0M8HOMl2GsVbs97GpJWCY.png,RISE,,,1,my.ai.se,,80,2025-10-15 16:50:01,,,,"Usecases & Inspiration, Ecosystem & Partners, Competence & Expertise, Culture & Mindset, Technology, Vision & Strategy, Data"
1137,Layke Analytics,startup,https://laykeanalytics.com/,"Layke is an API solution for intelligent screening and matching. Trained on a large amount of data and built on advanced machine learning technology, our algorithm has the capacity to read, interpret and analyse documents like a human resource, but faster. In an ever-growing market, Layke supports recruiting companies to fill in positions faster and more efficiently based on clear and objective data. Our algorithm transforms a process where the unconscious human bias sometimes can’t be avoided and encourages a transparent, skill-based recruitment.",,Sweden,,https://aihubtest-bucket.s3.eu-north-1.amazonaws.com/public/storage/images/328/Layke-logo.png,,,,1,my.ai.se,,85,2025-10-15 16:50:01,Information Technology,Human Resources,,"Usecases & Inspiration, Competence & Expertise, Culture & Mindset, Technology, Vision & Strategy"
1139,Big Data Value Association,network,https://www.bdva.eu,"The Big Data Value Association – BDVA, (from 2021, DAIRO - Data, AI and Robotics aisbl), is an industry-driven international not–for-profit organisation with more than 230 members all over Europe and a well-balanced composition of large, small, and medium-sized industries as well as research and user organizations. BDVA/DAIRO focuses on enabling the digital transformation of the economy and society through Data and Artificial Intelligence by advancing in areas such as big data and AI technologies and services, data platforms and data spaces, Industrial AI, data-driven value creation, standardisation, and skills. BDVA/DAIRO has been the private side of the H2020 partnership Big Data Value cPPP, it is a private member of the EuroHPC JU and is also one of the founding members of the AI, Data and Robotics Partnership. BDVA/DAIRO is an open and inclusive community and is always eager to accept new members who share these ambitious objectives. The mission of the BDVA is to develop the Innovation Ecosystem that will enable the data and AI-driven digital transformation in Europe delivering maximum economic and societal benefit, and, achieving and sustaining Europe’s leadership on Big Data Value creation and Artificial Intelligence. BDVA is open to new members to further enrich the data value ecosystem and play an active role. These include Data Users, Data Providers, Data Technology Providers and Researchers. BDVA enables existing regional multi-partner cooperation, to collaborate at European level through the provision of tools and knowhow to support the co-creation, development and experimentation of pan-European data-driven applications and services, and know-how exchange.",,Sweden,,https://aihubtest-bucket.s3.eu-north-1.amazonaws.com/public/storage/images/417/BDVA.png,,,,1,my.ai.se,,75,2025-10-15 16:50:01,,,,Data
1141,The University of Texas at Austin McCombs School of Business,academia,https://www.mccombs.utexas.edu,"For 100 years, McCombs School of Business has been home to a diverse community of learners, scholars, and trailblazers at the forefront of transformation in business. The McCombs School of Business is a top-ranked business school welcoming the enterprising spirit of students everywhere. Whether you’re developing an app that will disrupt aerospace or you’re committed to activating community change - our curriculum complements the valuable skill sets you are bringing to our table Develop leadership and management skills across a range of competency areas through short, non-degree programs specifically designed for organizations and working professionals.",,Sweden,,https://aihubtest-bucket.s3.eu-north-1.amazonaws.com/public/storage/images/4786/23456646_10155701293771438_4787411338355202802_o.jpg,,,,1,my.ai.se,,80,2025-10-15 16:50:01,Education,,,
1143,Knowing Company,startup,https://knowingcompany.com,"We make a Basic Human, a conversational AI based on evolution of human mind.",,Sweden,,https://aihubtest-bucket.s3.eu-north-1.amazonaws.com/public/storage/images/484/Knowing-Company-Logo.png,,,,1,my.ai.se,,60,2025-10-15 16:50:01,,IT & Software,,Technology
1144,Göteborgs Stad,publicsector,https://goteborg.se,"Omgivet av klippor, skogar, sjöar och havet i väster ligger Göteborg, Sveriges näst största stad med nära 560 000 invånare. Här finns det mesta du kan förvänta dig av en storstad – men med nära avstånd till allt. I Göteborgs Stad arbetar drygt 50,000 medarbetare inom stadsdelar, fackförvaltningar och kommunala bolag. Vårt gemensamma uppdrag är att skapa en bra vardag för boende, besökare och näringsliv och utveckla Göteborg till en hållbar stad, som är öppen för världen. Just nu händer det mycket i Göteborg! Staden växer kraftigt och förbereder sig för att kunna göra plats för ytterligare 150 000 fler göteborgare år 2035. En sådan förändring kräver att vi tänker hållbart. Vi strävar mot ett jämlikt Göteborg, där alla kan leva ett gott liv.",,Sweden,,https://aihubtest-bucket.s3.eu-north-1.amazonaws.com/public/storage/images/574/gbg.png,,,,1,my.ai.se,,80,2025-10-15 16:50:01,Municipality,,,
1148,AI Lund,academia,https://www.ai.lu.se/start,"AI Lund is a network for understanding, explaining and improving education, research and collaboration around AI based on the scope of the university activities. Research on artificial intelligence and machine learning at Lund University is done at many departments at most faculties. AI Lund is an interdisciplinary open network for research, education and innovation in the field of Artificial Intelligence, coordinated by Lund University. You are welcome to contact AI Lund through any of the members of the coordination group here.",,Sweden,,https://aihubtest-bucket.s3.eu-north-1.amazonaws.com/public/storage/images/4783/Screen-Shot-2022-12-12-at-13.38.17.png,Lunds Universitet,,,1,my.ai.se,,85,2025-10-15 16:50:01,Education,,,
1149,Vinnova,publicsector,https://www.vinnova.se,,,Sweden,,https://aihubtest-bucket.s3.eu-north-1.amazonaws.com/public/storage/images/1274/Vinnova.png,,,,1,my.ai.se,,50,2025-10-15 16:50:01,Authority & Agency,,,
1152,Rek.ai,startup,https://rek.ai,"Rek.ai är en lättanvänd saas-tjänst som kan installeras med hjälp av javascript på webbplatser, intranät och i appar. Tex som här på my.ai, där rek.ai visar personaliserade rekommendationer i högerspalten. I grundutförandet baseras rekommendationerna från tjänsten på anonym besöksdata, men har en rad anpassningsbara faktorer. E-com och tech-företag har förbättrat användarupplevelsen med hjälp av automatiserade rekommendationer under lång tid. Nu ser vi en tydlig trend, där alla typer av webbplatser går mot att serva användarna med relevant innehåll. Vi har skapat en rekommendationsmotor, baserad på deep learning teknik, som går att använda för att föreslå relevanta länkar, nyheter, sökord och navigering. Rek.ai har över 100 aktiva AI-projekt som automatiskt tränas och installeras varje dygn.",,Sweden,,https://aihubtest-bucket.s3.eu-north-1.amazonaws.com/public/storage/images/4890/logo-rekai-blue-white-bg@2x.png,,,,1,my.ai.se,,85,2025-10-15 16:50:01,"Retail, Municipality, Authority & Agency, Education, Media, Region","Customer Service & Support, Marketing & Communications, Operations, Human Resources, Sales",,"Usecases & Inspiration, Execution, Organization, Technology, Vision & Strategy, Data"
1153,Adopticum,organizer,,,,Sweden,,https://aihubtest-bucket.s3.eu-north-1.amazonaws.com/public/storage/images/665/Screenshot-2021-11-18-at-10.17.32.png,,,,1,my.ai.se,,30,2025-10-15 16:50:01,,,,
1155,University of Helsinki,academia,https://www.helsinki.fi/sv,University of Helsinki,,Sweden,,https://aihubtest-bucket.s3.eu-north-1.amazonaws.com/public/storage/images/716/HY__LD01_LogoFP_EN_B3____BW.png,,,,1,my.ai.se,,50,2025-10-15 16:50:01,Education,,,
1156,Chalmers,academia,https://www.chalmers.se,"Chalmers University of Technology in Gothenburg conducts research and education in technology and natural sciences at a high international level. The university has 3100 employees and 10,000 students, and offers education in engineering, science, shipping and architecture. With scientific excellence as a basis, Chalmers promotes knowledge and technical solutions for a sustainable world. Through global commitment and entrepreneurship, we foster an innovative spirit, in close collaboration with wider society. The EU’s biggest research initiative – the Graphene Flagship – is coordinated by Chalmers. We are also leading the development of a Swedish quantum computer. Chalmers was founded in 1829 and has the same motto today as it did then: Avancez – forward",,Sweden,,https://aihubtest-bucket.s3.eu-north-1.amazonaws.com/public/storage/images/718/Chalmers.png,,,,1,my.ai.se,,80,2025-10-15 16:50:01,Education,,,
1157,Skyqraft,startup,https://www.skyqraft.com/,"Skyqraft is on a mission to revolutionize the infrastructure inspection market. We are a team of experts, with extensive and in depth expertise within power line inspections, machine learning and computer vision, drone operations, customer service and business management. We believe that this diversity in experience is a major factor contributing to our success, making us a knowledgeable, trustworthy partner. Founded in Sweden. Skyqraft is an innovative technology company helping utilities make better decisions about their grids. Leveraging artificial intelligence, aerial grid images are converted into powerful and usable management information. By analyzing and visually displaying grid insights, Skyqraft enables you to make smarter, more sustainable and cost-efficient daecisions about your grid maintenance. Our progress Today, Skyqraft is a trusted partner of some of the most forward looking and influential utility companies in Europe and North America, providing them with data and insights needed to plan and maintain tomorrow’s linear infrastructure . Skyqraft offers low upfront costs and limited technical barriers to get started with our software and services. Predict and avoid equipment breakdowns When your grid and equipment is constantly running - affected by harsh weather, growing vegetation and aging materials - they will inevitably break down. Skyqraft’s software gives you an accurate inventory and ensures when those unplanned breakdowns happen, you have powerful visuals and metrics of the grid, making maintenance planning more efficient. Keep maintenance costs to a minimum Skyqraft analytics provides you with full visual understanding of your grid, allowing you to make the most cost-effective decisions for your maintenance organization. Access a visual data hub for your grid Skyqraft allows all relevant functions of your organization to access the visual data, improving communication between grid owners, vegetation management, line workers and maintenance staff. Skyqraft’s software allows you to instantly pull data, add comments and see comment history, share visual data internally, generate reports and more.In addition, Skyqraft supports seamless integration to all major AMS systems Enable a safer and more sustainable environment Co2 emissions saved, costs lowered and a safer work environment achieved as fewer site visits are needed. Planning of maintenance work can be done through Skyqraft’s software from your office desk.",,Sweden,,https://aihubtest-bucket.s3.eu-north-1.amazonaws.com/public/storage/images/4821/1648536062142.jpg,,,,1,my.ai.se,,85,2025-10-15 16:50:01,"Automotive, Information Technology, Telecommunications, Transportation & Logistics","Sustainability / Ethics / CSR, Purchasing & Procurement, Operations",,"Usecases & Inspiration, Technology, Data"
1160,DIGG - Agency for Digital Government,publicsector,https://www.digg.se/,"Our mission is to digitalise Sweden In order to achieve a sustainable welfare society, the digitalisation of Sweden needs to be intensified. That is the purpose of DIGG. Together with the entire public administration, we strive to make the transition happen – and benefit all.",,Sweden,,https://aihubtest-bucket.s3.eu-north-1.amazonaws.com/public/storage/images/865/digg-logga.png,,,,1,my.ai.se,,75,2025-10-15 16:50:01,Authority & Agency,"Research & Development, IT & Software, Legal & Compliance",,"Usecases & Inspiration, Ecosystem & Partners, Execution, Competence & Expertise, Culture & Mindset, Organization, Technology, Vision & Strategy, Data"
1161,Volvo Cars,corporation,https://www.volvocars.com/,"From the very outset Volvo Cars has been a brand for people who care about the world we live in and the people around us. We have made it our mission to make life easier, better and safer for everyone.",,Sweden,,https://aihubtest-bucket.s3.eu-north-1.amazonaws.com/public/storage/images/886/286708_Volvo_Iron_Mark.jpg,,,,1,my.ai.se,,75,2025-10-15 16:50:01,Automotive,"Research & Development, IT & Software, Legal & Compliance, Customer Service & Support, Marketing & Communications, Operations, Production",,"Usecases & Inspiration, Technology, Data"
1162,Sahlgrenska Universitetssjukhuset,publicsector,https://www.sahlgrenska.se,"Kompetens och omtanke På Sahlgrenska Universitetssjukhuset finns kompetensen att utföra de allra mest avancerade behandlingar och ingrepp som dagens medicinska utveckling tillåter. Samtidigt är omtanken och omvårdnaden om patienten vårt främsta fokus. För att kunna garantera kvalitet är ständig utveckling och förbättring ett viktigt mål. Som ett av landets största universitetssjukhus har vi närheten till allt det som erbjuds inom utbildning och forskning på Sahlgrenska akademin vid Göteborgs universitet. Bredd och djup Sahlgrenska Universitetssjukhuset fungerar som ett länssjukhus för invånarna i Göteborgsområdet. I Västra Götalandsregionens är vi en motor för hälso- och sjukvårdsutvecklingen. Patienter från hela regionen kommer hit för olika specialistbehandlingar och kunskap förs också ut till regionen. Vi har spetskompetens inom cirka 25 specialiteter och behandlar patienter från hela Sverige. Det gäller bland annat hjärt- och kärlsjukvård, rekonstruktiv kirurgi, barnsjukvård, vaccin, immunologi, reumatologi och kateterburen intervention. Barnhjärtkirurgin på vårt barnsjukhus, Drottning Silvias barn- och ungdomssjukhus, har utsetts till rikssjukvård av Socialstyrelsen. Flera platser i Göteborgsområdet Vår verksamhet finns på flera platser i Göteborgsområdet – på Sahlgrenska sjukhuset, Östra sjukhuset, Mölndals sjukhus, Högsbo sjukhus och på flera öppenvårdsmottagningar runtom i stan. Tillsammans arbetar cirka 17 000 medarbetare hos oss, vilket gör sjukhuset till en av de största arbetsplatserna i Västra Götalandsregionen.",,Sweden,,https://aihubtest-bucket.s3.eu-north-1.amazonaws.com/public/storage/images/894/Sahlgrenska.jpeg,,,,1,my.ai.se,,80,2025-10-15 16:50:01,Healthcare & Life Sciences,,,
1163,Stockholms stad,publicsector,http://start.stockholm,"Our aim is to continuously develop Stockholm, to be there for its citizens and to make Stockholm Northern Europe's most attractive city for people and businesses looking for high quality of life, financial growth and a vibrant, knowledge-based environment.",,Sweden,,https://aihubtest-bucket.s3.eu-north-1.amazonaws.com/public/storage/images/10502/StockholmsStad_logotypeStandardA3_300ppi_svart.png,,,,1,my.ai.se,,75,2025-10-15 16:50:01,Municipality,"Child Protection, Accounting & Finance, Culture & Leisure, Environment, Operations, Social Services, Traffic & Infrastructure, Education & Learning, Innovation",,"Organization, Technology"
1166,TecPoint,supplier,https://tecpoint.se,"TecPoint is a Swedish company focusing on delivering advanced R&D services in Industrial AI to innovative and high-growth companies. We are experts in machine learning, computer vision, augmented reality, sensors, IoT and autonomous systems. The company has provided R&D services since 2006 and has customers in the Nordics and Western Europe. We support innovation and growth by providing a flexible R&D structure to high-tech companies and start-ups. We work in close cooperation with specialized partners, providing access to state-of-the-art competence.",,Sweden,,https://aihubtest-bucket.s3.eu-north-1.amazonaws.com/public/storage/images/4781/1519901053405.jpg,,,,1,my.ai.se,,85,2025-10-15 16:50:01,"Automotive, Research, Healthcare & Life Sciences, Information Technology, Food & Farming, Manufacturing, Transportation & Logistics",Research & Development,,
1168,ALMI Mälardalen,corporation,https://www.almi.se/om-almi/kontakt/kontaktlista/?office=4423,"Det här gör Almi Ska du göra verklighet av din idé? Vill du bygga ett företag som är lönsamt, växande och långsiktigt hållbart? I så fall borde du vända dig till oss på Almi. Tillsammans kan vi ta ditt företagande till en ny nivå. Vi på Almi har länge arbetat nära tillväxtföretag. Det har gett oss en unik erfarenhet av de utmaningar som tillväxtföretagande innebär. Det har också lärt oss en hel del om vad som behövs för att lyckas. Vi erbjuder lån och affärsutveckling till företag med tillväxtpotential. Det gäller såväl företag som är i startupfas som befintliga företag. Genom dotterbolaget Almi Invest investerar vi riskkapital i företag i tidiga skeden med stor tillväxtpotential och en skalbar affärsidé. Almi kan bidra på flera olika sätt under företagets tillväxtresa. Ju större potential ditt företag har att växa, desto mer resurser kan Almi satsa. Den första kontakten med Almi startar alltid med en dialog om företagets behov. Den visar om det finns behov av Almis tjänster eller om det finns andra aktörer som bättre tillgodoser företagets behov. Våra rådgivare har lång erfarenhet av att vägleda företag framåt på tillväxtresan. Oavsett var du är på den resan bör du kontakta Almi.",,Sweden,,https://aihubtest-bucket.s3.eu-north-1.amazonaws.com/public/storage/images/1070/Unknown.png,,,,1,my.ai.se,,75,2025-10-15 16:50:01,,,,
1170,OpenMined,network,https://www.openmined.org,LET'S SOLVE PRIVACY OpenMined is an open-source community whose goal is to make the world more privacy-preserving by lowering the barrier-to-entry to private AI technologies.,,Sweden,,https://aihubtest-bucket.s3.eu-north-1.amazonaws.com/public/storage/images/1092/OpenMined.png,,,,1,my.ai.se,,60,2025-10-15 16:50:01,,Sustainability / Ethics / CSR,,"Usecases & Inspiration, Ecosystem & Partners, Technology, Data"
1172,DeepMind,corporation,https://deepmind.com,"We’ve always been fascinated by human intelligence – it shaped the modern world we live in today. Intelligence allows us to learn, imagine, cooperate, create, communicate, and so much more. By better understanding different aspects of intelligence, we can use this knowledge as inspiration to build novel computer systems that learn to find solutions to difficult problems on their own.",,Sweden,,https://aihubtest-bucket.s3.eu-north-1.amazonaws.com/public/storage/images/1178/DeepMind.jpeg,Google,,,1,my.ai.se,,75,2025-10-15 16:50:01,Research,,,Technology
1175,AI Singapore,network,https://aisingapore.org,"AI Singapore (AISG) is a national AI programme launched by the National Research Foundation (NRF) to anchor deep national capabilities in Artificial Intelligence (AI) thereby creating social and economic impacts, grow the local talent, build an AI ecosystem, and put Singapore on the world map. The programme office is hosted by the National University of Singapore (NUS) and brings together all Singapore-based research institutions and the vibrant ecosystem of AI start-ups and companies developing AI products to perform use-inspired research, grow the knowledge, create the tools, and develop the talent to power Singapore’s AI efforts. AISG is driven by a government-wide partnership comprising NRF, the Smart Nation and Digital Government Office (SNDGO), the Economic Development Board (EDB), the Infocomm Media Development Authority (IMDA), SGInnovate, and the Integrated Health Information Systems (IHiS).",,Sweden,,https://aihubtest-bucket.s3.eu-north-1.amazonaws.com/public/storage/images/1288/AI-Singapore.jpeg,,,,1,my.ai.se,,80,2025-10-15 16:50:01,"Research, Information Technology, Education",,,
1178,AMD Silo AI,supplier,https://www.amd.com/en/solutions/ai/silo-ai.html,AMD Silo AI is a leading AI lab focused on developing advanced AI models and solutions optimized for AMD leadership compute platforms.,,Sweden,,https://aihubtest-bucket.s3.eu-north-1.amazonaws.com/public/storage/images/22848/download.jpeg,,,,1,my.ai.se,,60,2025-10-15 16:50:01,"Retail, Financial, Automotive, Research, Healthcare & Life Sciences, Information Technology, Telecommunications, Manufacturing, Media",,,
1182,PICTA Prehospital Innovation Arena,team,http://picta.lindholmen.se,"Prehospital Innovationsarena - IT och eHälsa för bättre sjukvård Arenan drivs av Lindholmen Science Park i samarbete med ett trettiotal organisationer från sjukvård, näringsliv och akademi. Genom gemensamma projekt, kunskapsspridning och forskning vill vi säkerställa att IT och e-hälsa används på bästa sätt inom den prehospitala sjukvården.",,Sweden,,https://aihubtest-bucket.s3.eu-north-1.amazonaws.com/public/storage/images/4779/Screen-Shot-2022-12-12-at-13.18.42.png,,,,1,my.ai.se,,75,2025-10-15 16:50:01,"Research, Healthcare & Life Sciences, Information Technology, Region",Innovation,,"Usecases & Inspiration, Competence & Expertise, Technology, Vision & Strategy, Data"
