id,name,type,website,description,location_city,location_country,location_greater_stockholm,logo_url,owner,maturity,accepts_interns,is_swedish,source,metadata_source_url,data_quality_score,last_updated,sectors,domains,ai_capabilities,dimensions
1476,Magic Fabric,media,https://magicfabricblog.com/,"Magic Fabric is a blog and a leading source of inspiration showcasing talented individuals and cutting-edge software in CGI, AI, and XR that are shaping the future of fashion and digital entertainment. Additionally, Magic Fabric serves as a talent network for the tech-savvy creator community. With international recognition and a following of 60k on Instagram, it is a go-to resource for those interested in exploring new fashion futures.",,Sweden,,https://aihubtest-bucket.s3.eu-north-1.amazonaws.com/public/storage/images/10348/square.png,,,,1,my.ai.se,,75,2025-10-15 16:50:01,"Information Technology, Media","Marketing & Communications, Innovation",,"Competence & Expertise, Technology, Vision & Strategy"
1477,The Swedish American Chamber of Commerce - New England,network,,,,Sweden,,,,,,1,my.ai.se,,30,2025-10-15 16:50:01,Region,,,
1479,Gathers,network,https://www.gathers.ai/,"Introducing the Gathers.ai Community: the hub for uniting European AI and fostering a collaborative learning experience. Our mission is to bring together brilliant minds in AI/ML and make their knowledge accessible through a peer-driven approach, industry insider guidance, and hands-on experience. Our community emphasises the benefits of learning from diverse backgrounds, allowing for more efficient and rapid knowledge acquisition. Our industry insiders provide practical insights and advice from top-notch AI companies, ensuring you gain actionable knowledge and real-world skills applicable to your product needs. Every week we host a unique Papers Club, where participants validate hypotheses quickly by synthesising new ideas from research papers through active discussions. Each event focuses on a specific topic, and our smart matchmaking breakout rooms ensure you learn better from your group of peers. Real-time solutions feedback is provided by AI/ML expert moderators to maximise your learning experience. Join our Discord community, where we unite a multifaceted European AI ecosystem. Come for the experts and stay for the incredible community that we're building together. At Gathers.ai, we're committed to fostering an environment where AI professionals and enthusiasts can connect, share knowledge, and grow as we shape the future of European AI.",,Sweden,,https://aihubtest-bucket.s3.eu-north-1.amazonaws.com/public/storage/images/5950/Screenshot-2023-03-15-at-11.42.02.png,,,,1,my.ai.se,,80,2025-10-15 16:50:01,Information Technology,,,
1482,Freelance journalist,media,,Freelance within AI and politics.,,Sweden,,,,,,1,my.ai.se,,30,2025-10-15 16:50:01,Media,,,
1486,DeepLearning.AI,academia,https://www.deeplearning.ai,"DeepLearning.AI is an education technology company that is empowering the global workforce to build an AI-powered future through world-class education, hands-on training, and a collaborative community.",,Sweden,,https://aihubtest-bucket.s3.eu-north-1.amazonaws.com/public/storage/images/6066/https---cdn.evbuc.com-images-125559383-317212851579-1-original.20210208-232017.png,,,,1,my.ai.se,,70,2025-10-15 16:50:01,Education,,,
1490,WOWEN,supplier,https://wowen.tech,Weaving the web.,,Sweden,,https://aihubtest-bucket.s3.eu-north-1.amazonaws.com/public/storage/images/7777/wowen-logo.png,,,,1,my.ai.se,,50,2025-10-15 16:50:01,Information Technology,,,
1494,Noodl,startup,https://www.noodl.net/noodl-ai,"Noodl's AI-driven platform, powered by cutting-edge large language models (LLMs) such as ChatGPT, revolutionizes how we approach complex app development. Our innovative platform automates software creation through a visual interface, accelerating time-to-market and enabling you to deliver complex, enterprise-grade solutions faster than ever before.",,Sweden,,https://aihubtest-bucket.s3.eu-north-1.amazonaws.com/public/storage/images/6241/LinkedIn_1200x627.png,,,,1,my.ai.se,,75,2025-10-15 16:50:01,Information Technology,Innovation,,Technology
1496,Webuters Technologies Pvt. Ltd.,corporation,https://www.webuters.com/,"Webuters Technologies Pvt Ltd is one of the leading companies that offer a wide range of services for vast types of industries. We are a leading Salesforce partner in the USA. We have our offices in USA and India. We have developed over 500+ apps in various technologies and platforms. Webuters has provided services for startups, SMEs, and well-established brands. We work as an authorized AWS partner to provide you with the best cloud solutions. Apart from that we also offer Google cloud and Microsoft Azure cloud services. We build fast and scalable android and iOS apps for your business. Webuters offer web design and development services, ReactJS Development, NodeJS development, UiPath, and RPA development services, Blue prism development, Shopify development, CRM & ERP development, It consulting, API Development, System Integration, and Migration services.",,Sweden,,https://aihubtest-bucket.s3.eu-north-1.amazonaws.com/public/storage/images/6257/Webuters-Technologies.jpg,,,,1,my.ai.se,,80,2025-10-15 16:50:01,Information Technology,,,
1497,Playground TV,startup,https://playground.tv,"Storyplai is our AI-powered app launching in 2023 that allows children and parents to become the authors of their own adventure stories. With a mix of AI-generated prompts, Storyplai is the ultimate tool for anyone who loves to explore their creativity and take their storytelling to the next level. To learn more, visit www.storyplai.com. Playground TV was established in 2019 with the mission to foster curiosity about diversity among kids. Our platform offers cartoons from all over the world, and as a Free Ad Supported Television (FAST), we are witnessing rapid growth in the United States, with plans to expand into Europe. As a multilingual streaming service for children, Playground TV is available on Android and iOS and currently boasts over 180 animated shows in 9 different languages, including non-verbal content. Our ambition is to build a kids-first, multilingual media company with a passion for diversity, fun & learning technology, while also prioritizing online safety and protecting our children's childhood.",,Sweden,,https://aihubtest-bucket.s3.eu-north-1.amazonaws.com/public/storage/images/6287/pg_logo.jpg,,,,1,my.ai.se,,80,2025-10-15 16:50:01,Media,,,
1499,Merantix Momentum GmbH,startup,https://www.merantix-momentum.com/,"Merantix Momentum designs, develops and operates AI from research to application for companies across all industries, dynamically translating its leading AI research into customized solutions with business expertise to create domain-specific value.. We are your partner for machine learning and AI. We support your company from the identification of use cases to the development and operation of AI solutions. Aside from direct client projects, our dedicated research team is always looking for opportunities to start new joint research and development projects. Please don't hesitate to reach out to fabio.haenel@merantix.com.",,Sweden,,https://aihubtest-bucket.s3.eu-north-1.amazonaws.com/public/storage/images/6315/MerantixMomentum_Logo_RGB_blueberry.png,,,,1,my.ai.se,,85,2025-10-15 16:50:01,Information Technology,Research & Development,,
1503,Almi,publicsector,,Almis uppdrag Det övergripande målet med verksamheten är att främja utveckling av konkurrenskraftiga små och medelstora företag och stimulera nyföretagandet i syfte att skapa tillväxt och förnyelse i svenskt näringsliv. Almi AB ägs av staten och är moderbolag i en koncern med 16 regionala dotterbolag och underkoncernen Almi Invest. De regionala dotterbolagen ägs till 51 procent av moderbolaget och till 49 procent av regionala ägare och erbjuder lån och affärsutveckling. Almi Invest AB ägs till 100 procent av moderbolaget och bedriver riskkapitalverksamhet.,,Sweden,,https://aihubtest-bucket.s3.eu-north-1.amazonaws.com/public/storage/images/6370/almi-ny-rosa.jpg,,,,1,my.ai.se,,65,2025-10-15 16:50:01,Authority & Agency,,,
1505,MinnaLearn,corporation,https://www.minnalearn.com,"We make workplace learning experiences for teams. Our method combines online self-study with group meetings to create shared journeys with guaranteed outcomes. Companies run MinnaLearn training effortlessly with our online platform and comprehensive facilitator toolkit. MinnaLearn’s courses are created by leading experts and trusted by business leaders, governments, and one million learners.",,Sweden,,https://aihubtest-bucket.s3.eu-north-1.amazonaws.com/public/storage/images/6400/Minnalearn.png,,,,1,my.ai.se,,70,2025-10-15 16:50:01,Education,,,
1506,Synai,supplier,,Helping businesses grow across Europe with the help of AI and LLMs,,Sweden,,,,,,1,my.ai.se,,45,2025-10-15 16:50:01,Information Technology,Innovation,,Competence & Expertise
1508,Unesco,ngo,https://www.unesco.org,"UNESCO is the United Nations Educational, Scientific and Cultural Organization. It contributes to peace and security by promoting international cooperation in education, sciences, culture, communication and information. UNESCO promotes knowledge sharing and the free flow of ideas to accelerate mutual understanding and a more perfect knowledge of each other's lives. UNESCO's programmes contribute to the achievement of the Sustainable Development Goals defined in the 2030 Agenda, adopted by the UN General Assembly in 2015.",,Sweden,,https://aihubtest-bucket.s3.eu-north-1.amazonaws.com/public/storage/images/6420/unesco_logo_ver_blue_eng.png,,,,1,my.ai.se,,80,2025-10-15 16:50:01,"Research, Education",,,
1509,IRC AI,ngo,https://ircai.org,"INTERNATIONAL RESEARCH CENTRE ON ARTIFICIAL INTELLIGENCEUNDER THE AUSPICES OF UNESCO A coordination point, funding route and exploitation accelerator for approaches to the UN SDGs that make use of AI",,Sweden,,https://aihubtest-bucket.s3.eu-north-1.amazonaws.com/public/storage/images/6440/IRC-AI.png,Unesco,,,1,my.ai.se,,65,2025-10-15 16:50:01,Research,,,
1511,Semanttic AB,startup,https://www.semanttic.com,Semanttic is an AI Co-pilot for Product Design. We democratise design for any product builder to generate user interfaces based on their text prompts.,,Sweden,,https://aihubtest-bucket.s3.eu-north-1.amazonaws.com/public/storage/images/6468/Glyph-RGB-Trans.png,,,,1,my.ai.se,,65,2025-10-15 16:50:01,Information Technology,Innovation,,Technology
1512,Science for Life Laboratory /Chalmers,academia,,Support manager - NBIS Manager DDLS Data Science Node - cell and molecular biology,,Sweden,,,,,,1,my.ai.se,,40,2025-10-15 16:50:01,"Research, Healthcare & Life Sciences, Information Technology",,,
1514,Swedish Red Cross,ngo,,,,Sweden,,,,,,1,my.ai.se,,30,2025-10-15 16:50:01,Civil Society,,,
1515,DigJourney,supplier,http://www.digjourney.com/ai,"DigJourney hjälper er att skapa förutsättningar och förmågor för att redan idag skapa värde med hjälp av AI. Vi har AI-konsulter, utbildningar, workshopar och processer som får fart på arbetet med AI. Vi har också tekniska partners som vi krokar arm med för att göra AI-implementationer. Här är exempel på vad vi kan stötta med i olika faser i AI-resan: Steg 1: Skapa medvetenhet och inspirera till handling Kurs: Kom igång med generativ AI med Paulina Modlitba Workshop: Introduktion till AI för ledare och verksamheter Workshop: Rusta din styrelse för framtidens AI-möjligheter och utmaningar Ta fram en AI-playbook/policy Steg 2: Börja lära, testa och experimentera Utbildning - Att leda AI-transformation Utbildning: Styrelsens roll i AI-transformationen (Tillsammans med Styrelseakadmien Stockholm) Ta fram en AI-pilot Workshop: ta kliv i ert beslutsfattande genom samarbetsbaserad AI (Tillsammans med River) Steg 3: Skapa grunden till att accelerera er AI-transformation Ta fram en (AI)-målbild som skapar riktning och engagemang Ta reda på ert nuläge genom att mäta er AI-mognad Skapa en transformationsplan för att nå målbilden Process-, system- och informationsflödeskartläggning Skapa förutsättningar för storskaligt lärande i din organisation Öka innovationstakten med hjälp av extern finansiering Vi jobbar också med ren rådgiving och anpassade upplägg - kontakta oss för att veta mer. På vår site kan ni läsa mer och se exempel på kunder vi jobbar med!",,Sweden,,https://aihubtest-bucket.s3.eu-north-1.amazonaws.com/public/storage/images/6538/dj_logo-primary-stacked.png,,,,1,my.ai.se,,85,2025-10-15 16:50:01,"Information Technology, Consulting & Advisory, Education","Sustainability / Ethics / CSR, IT & Software, Management & Leadership, Education & Learning, Innovation",,"Usecases & Inspiration, Ecosystem & Partners, Execution, Competence & Expertise, Culture & Mindset, Organization, Technology, Vision & Strategy, Data"
1519,Arxiv,academia,https://arxiv.org,"arXiv is a free distribution service and an open-access archive for 2,271,903 scholarly articles in the fields of physics, mathematics, computer science, quantitative biology, quantitative finance, statistics, electrical engineering and systems science, and economics. Materials on this site are not peer-reviewed by arXiv.",,Sweden,,https://aihubtest-bucket.s3.eu-north-1.amazonaws.com/public/storage/images/6610/arxiv_icon.png,,,,1,my.ai.se,,70,2025-10-15 16:50:01,"Research, Education",,,"Technology, Data"
1521,Internetstiftelsen,ngo,https://internetstiftelsen.se/en/,"Internetstiftelsen är en oberoende, affärsdriven och allmännyttig organisation. Vi verkar för ett internet som bidrar positivt till människan och samhället. Vi ansvarar för internets svenska toppdomän .se och sköter drift och administration av toppdomänen .nu. Intäkterna från affärsverksamheten finansierar en rad satsningar i syfte att möjliggöra att människor kan nyttja internet på bästa sätt, och stimulera kunskapsdelning och innovation med inriktning på internet.",,Sweden,,https://aihubtest-bucket.s3.eu-north-1.amazonaws.com/public/storage/images/6623/8f8cd82c9f586abe_org.png,,,,1,my.ai.se,,75,2025-10-15 16:50:01,Information Technology,IT & Software,,
1524,Dakota State University,academia,https://dsu.edu,"DSU's mission is to prepare cyber-savvy graduates who are lifelong learners, problem solvers, innovators, and leaders to live lives of positive purpose and consequence. Vision: Innovative, entrepreneurial, and resilient since 1881, DSU will continue to rise through short - and long-term success of our students and graduates, increased strength in applied research and athletics, and deep engagement with our stakeholders, in an environment infused with quality improvement.",,Sweden,,https://aihubtest-bucket.s3.eu-north-1.amazonaws.com/public/storage/images/6646/DSU_UniversityLogo_Icon_Primary.png,,,,1,my.ai.se,,75,2025-10-15 16:50:01,Education,Research & Development,,Competence & Expertise
1528,Hub France IA,ngo,https://www.hub-franceia.fr,Federating French AI players The Hub France IA is committed to boosting the AI ecosystem by encouraging the proximity of actors in order to accelerate the development of operational projects. The Hub France IA is an association under the 1901 law that aims to federate the actors of the AI ecosystem to allow the development of proposals and concrete solutions.,,Sweden,,https://aihubtest-bucket.s3.eu-north-1.amazonaws.com/public/storage/images/6712/Favicon.png,,,,1,my.ai.se,,65,2025-10-15 16:50:01,,,,Ecosystem & Partners
1532,World Economic Forum,ngo,https://www.weforum.org,"The World Economic Forum is the International Organization for Public-Private Cooperation. The Forum engages the foremost political, business, cultural and other leaders of society to shape global, regional and industry agendas. It was established in 1971 as a not-for-profit foundation and is headquartered in Geneva, Switzerland. It is independent, impartial and not tied to any special interests. The Forum strives in all its efforts to demonstrate entrepreneurship in the global public interest while upholding the highest standards of governance. Moral and intellectual integrity is at the heart of everything it does. Our activities are shaped by a unique institutional culture founded on the stakeholder theory, which asserts that an organization is accountable to all parts of society. The institution carefully blends and balances the best of many kinds of organizations, from both the public and private sectors, international organizations and academic institutions. We believe that progress happens by bringing together people from all walks of life who have the drive and the influence to make positive change.",,Sweden,,https://aihubtest-bucket.s3.eu-north-1.amazonaws.com/public/storage/images/6844/World_Economic_Forum_logo.svg.png,,,,1,my.ai.se,,80,2025-10-15 16:50:01,,Accounting & Finance,,
1534,European Commission,publicsector,https://commission.europa.eu/index_en,"The Commission helps to shape the EU's overall strategy, proposes new EU laws and policies, monitors their implementation and manages the EU budget. It also plays a significant role in supporting international development and delivering aid.",,Sweden,,https://aihubtest-bucket.s3.eu-north-1.amazonaws.com/public/storage/images/6856/European_Commission.svg.png,,,,1,my.ai.se,,70,2025-10-15 16:50:01,,"Accounting & Finance, Legal & Compliance, Management & Leadership",,
1541,Toloka,supplier,,"Toloka is a data-centric environment that supports AI development across the ML lifecycle with the help of human insight gathered in a responsible and secure way. We offer solutions for diverse use cases, including: - Audio & natural language processing - Computer vision - Chat bots & voice assistants - Search & information retrieval With 10+ years of industry experience, scientific research, and contributions to the AI community, we are committed to helping companies unlock AI opportunities.",,Sweden,,,,,,1,my.ai.se,,50,2025-10-15 16:50:01,Information Technology,,,
1542,Assemble Inc,supplier,https://asmbl.is,Assemble Inc Growth. Technology. Data. Design. We are a Retail Tech Consultancy.,,Sweden,,https://aihubtest-bucket.s3.eu-north-1.amazonaws.com/public/storage/images/6939/assemble_green.jpeg,,,,1,my.ai.se,,60,2025-10-15 16:50:01,"Retail, Media",,,
1543,"Grundskoleförvaltningen, Malmö stad",academia,,Grundskoleförvaltningen ansvarar för den kommunala grundskoleverksamheten och anpassade grundskolan i Malmö stad.,,Sweden,,,,,,1,my.ai.se,,40,2025-10-15 16:50:01,Education,,,
1549,CB Insights,corporation,https://www.cbinsights.com,"Tech is disrupting every business and industry. We’re here to help. We’re on a mission to enable every organization to make smarter decisions about tech. Whether it’s finding a new game-changing vendor or understanding a new market, it’s easier, faster and smarter with CB Insights. All made possible by the smartest, hardest-working team in tech.",,Sweden,,https://aihubtest-bucket.s3.eu-north-1.amazonaws.com/public/storage/images/7278/CBInsights.png,,,,1,my.ai.se,,70,2025-10-15 16:50:01,Information Technology,,,
1550,Mindact.ai,supplier,https://mindact.ai,"At Mindact.ai we specialize in developing people and organizations through artificial intelligence. As your strategic partner for innovation, we help companies exceed their business goals by leveraging deep technological understanding and strategic digitalization. We offer a comprehensive portfolio of services including:- Educational lectures and tailored training programs- In-depth analysis of AI opportunities- Implementation of AI and smart technical solutions- Custom AI development through our network of skilled partners Our mission is to evolve businesses and successfully navigate the AI landscape. We provide the knowledge and guidance needed to make informed decisions in this rapidly evolving field. By bridging the gap between cutting-edge AI and practical business applications, we help organizations unlock new efficiencies and opportunities in the digital age. Our collaborative approach and openness to new partnerships allow us to continuously expand our capabilities and deliver greater value to our clients. Let's connect and explore how AI can transform your business!",,Sweden,,https://aihubtest-bucket.s3.eu-north-1.amazonaws.com/public/storage/images/15517/Mindact.ai-transparent.png,,,,1,my.ai.se,,85,2025-10-15 16:50:01,"Information Technology, Consulting & Advisory, Education","IT & Software, Customer Service & Support, Management & Leadership, Marketing & Communications, Operations, Production, Sales, Education & Learning, Innovation",,
1552,Karolinska Universitetssjukhuset,publicsector,https://karolinska.se,"Karolinska University Hospital is one of the largest university hospitals in Europe. Together with the world-renowned Karolinska Institutet (KI), we are at the forefront of medical breakthroughs with the aim of knowing more tomorrow than we know today.",,Sweden,,https://aihubtest-bucket.s3.eu-north-1.amazonaws.com/public/storage/images/7335/IMG_6188.jpeg,,,,1,my.ai.se,,75,2025-10-15 16:50:01,Healthcare & Life Sciences,"Purchasing & Procurement, IT & Software, Legal & Compliance, Customer Service & Support, Management & Leadership, Operations, Production, Innovation",,"Usecases & Inspiration, Ecosystem & Partners, Execution, Competence & Expertise, Culture & Mindset, Organization, Technology, Vision & Strategy, Data"
1553,National City Lab,lab,https://www.ai.se/en/data-factory/national-city-lab,"National City Lab is Sweden’s first testbed for municipal data, facilitating a collaborative approach to AI initiatives for smart cities. A neutral and centralized hub for knowledge-sharing and experimentation, National City Lab aims to bring researchers, industry partners, and municipalities together to collaborate and use city data to find innovative and efficient ways of improving city services – enhancing the quality of life for Swedish citizens. Why the National City Lab? As cities continue to grow and face increasingly complex challenges, municipalities are under pressure to find innovative and efficient ways of improving city services, enhancing the quality of life for citizens, and boosting economic development. Smart city initiatives, which leverage technology and data to enhance urban infrastructure, are seen as a promising solution to many of these challenges; and AI has a significant role to play in helping cities achieve these goals. In addition, many municipalities in Sweden face similar challenges when embarking on their journey to implement AI in city development. Some of these challenges include limited resources, data privacy concerns, and lack of technical expertise. Although challenges are often similar in character and demand, work remains fragmented when it comes to finding solutions and working collaboratively across municipalities. National City Lab provides a unique opportunity to address these issues, bringing together municipalities, researchers, and industry partners to collaborate on finding solutions and data for smart cities. By creating a centralized hub for knowledge-sharing and experimentation, National City Lab aims to accelerate progress and enable more municipalities to benefit from AI implementation. Read more here",,Sweden,,https://aihubtest-bucket.s3.eu-north-1.amazonaws.com/public/storage/images/7382/Namnlös-design-(7).png,"Technological Infrastructure, AI Sweden",,,1,my.ai.se,,80,2025-10-15 16:50:01,,,,"Usecases & Inspiration, Ecosystem & Partners, Execution, Competence & Expertise, Organization, Technology, Vision & Strategy, Data"
1554,SSF Stöldskyddsföreningen,ngo,https://www.stoldskyddsforeningen.se/,"SSF Stöldskyddsföreningen, is a is an independent organization that works for the prevention against both physical and digital crimes. For everyones right to a secure life.",,Sweden,,https://aihubtest-bucket.s3.eu-north-1.amazonaws.com/public/storage/images/9502/logossf.jpg,,,,1,my.ai.se,,65,2025-10-15 16:50:01,Civil Society,Security,,Competence & Expertise
1556,Akademiska sjukhuset / Uppsala University Hospital,publicsector,,,,Sweden,,https://aihubtest-bucket.s3.eu-north-1.amazonaws.com/public/storage/images/7535/IMG_4394.png,,,,1,my.ai.se,,35,2025-10-15 16:50:01,Healthcare & Life Sciences,,,
