id,name,type,website,description,location_city,location_country,location_greater_stockholm,logo_url,owner,maturity,accepts_interns,is_swedish,source,metadata_source_url,data_quality_score,last_updated,sectors,domains,ai_capabilities,dimensions
1955,Danmarks Ambassade i Stockholm,publicsector,https://sverige.um.dk/,,,Sweden,,https://aihubtest-bucket.s3.eu-north-1.amazonaws.com/public/storage/images/15496/Stockholm-Danish.jpg,,,,1,my.ai.se,,50,2025-10-15 16:50:01,"Energy, Healthcare & Life Sciences, Information Technology, Municipality, Food & Farming, Telecommunications, Transportation & Logistics, Region",,,
1957,KAN Agency,corporation,https://kan.se,,,Sweden,,https://aihubtest-bucket.s3.eu-north-1.amazonaws.com/public/storage/images/15584/__sitelogo__Logo_black.png,,,,1,my.ai.se,,50,2025-10-15 16:50:01,Consulting & Advisory,,,
1959,FinetuneDB,startup,https://finetunedb.com,"FinetuneDB streamlines AI fine-tuning by providing an end-to-end platform to create and manage datasets, fine-tune and serve LLMs that are significantly cheaper and better performing. Use FinetuneDB to track production data, leverage collaborative tools for dataset creation, test different prompt and model versions, and create fine-tuned models.",,Sweden,,https://aihubtest-bucket.s3.eu-north-1.amazonaws.com/public/storage/images/15604/logo-with-padding.png,,,,1,my.ai.se,,75,2025-10-15 16:50:01,Information Technology,IT & Software,,Data
1960,Regeringen,publicsector,https://www.regeringen.se,"Regeringen styr Sverige och är drivande i arbetet med att förändra våra lagar, och påverkar på så vis utvecklingen i vårt samhälle. Sveriges regering består av en statsminister och 23 statsråd.",,Sweden,,https://aihubtest-bucket.s3.eu-north-1.amazonaws.com/public/storage/images/15610/Regeringen.png,,,,1,my.ai.se,,60,2025-10-15 16:50:01,"Civil Society, Municipality, Authority & Agency, Region",,,Organization
1962,Cillers,organizer,,"World Class Hackathons: Learn How To Build Better Software Systems Faster Cillers hackathons are fun and transformative experiences that significantly boost the speed and quality of your software development. Our hackathons foster engineering excellence and enable you to play around with new ground-breaking technologies, such as AI, new powerful APIs and cutting-edge software infrastructure tools. Everyone who wants to learn is welcome, from fresh beginner to seasoned expert. We have hosted hackathons in collaboration with many of the world's leading software technology companies, such as Google, Couchbase, Redpanda, Kong, Curity and Polytope.",,Sweden,,https://aihubtest-bucket.s3.eu-north-1.amazonaws.com/public/storage/images/15624/Cillers-banners---World-Class-Hackathons_Docs-Sharing-Image.png,,,,1,my.ai.se,,70,2025-10-15 16:50:01,Information Technology,Engineering,,Technology
1965,NATO,ngo,https://www.nato.int,"Security in our daily lives is key to our well-being. NATO’s purpose is to guarantee the freedom and security of its members through political and military means. POLITICAL – NATO promotes democratic values and enables members to consult and cooperate on defence and security-related issues to solve problems, build trust and, in the long run, prevent conflict. MILITARY – NATO is committed to the peaceful resolution of disputes. If diplomatic efforts fail, it has the military power to undertake crisis-management operations. These are carried out under the collective defence clause of NATO's founding treaty – Article 5 of the Washington Treaty or under a United Nations mandate, alone or in cooperation with other countries and international organisations.",,Sweden,,https://aihubtest-bucket.s3.eu-north-1.amazonaws.com/public/storage/images/15704/nato-8-logo-png-transparent.png,,,,1,my.ai.se,,80,2025-10-15 16:50:01,"Civil Society, Defense",,,
1974,Techlära,supplier,https://techlara.se/,Trött på repetativa uppgifter? Techlära är här för att underlätta din vardag med den senaste AI-tekniken. I en tid där teknologiska framsteg sker snabbare än någonsin står många företag inför utmaningen att identifiera de rätta verktygen som inte bara uppfyller era aktuella behov utan också främjar långsiktig tillväxt och innovation. Det är här vi kan göra skillnad. Titta in https://techlara.se/ för att boka ett kostnadsfritt möte eller kolla in våra kurser.,,Sweden,,https://aihubtest-bucket.s3.eu-north-1.amazonaws.com/public/storage/images/16023/hero.png,,,,1,my.ai.se,,75,2025-10-15 16:50:01,Consulting & Advisory,Education & Learning,,
1977,Ingrid Segerstedts gymnasium,publicsector,,,,Sweden,,,,,,1,my.ai.se,,30,2025-10-15 16:50:01,Education,,,
1978,Gelectric,startup,https://www.gelectric.io,Gelectric is a maritime software development company with the aim of creating sustainable and digital maritime industry and vessels.,,Sweden,,https://aihubtest-bucket.s3.eu-north-1.amazonaws.com/public/storage/images/16071/Gelectric-logo-transparrent.png,,,,1,my.ai.se,,65,2025-10-15 16:50:01,Transportation & Logistics,"Research & Development, IT & Software, Innovation",,"Technology, Data"
1983,Gro Innovation Labs,network,,,,Sweden,,,,,,1,my.ai.se,,35,2025-10-15 16:50:01,Consulting & Advisory,"Sustainability / Ethics / CSR, Management & Leadership, Operations, Human Resources, Urban Development, Social Services, Innovation",,
1987,Riksbanken,publicsector,https://www.riksbank.se/,"Riksbanken är Sveriges centralbank. Vi ska se till att inflationen är låg och stabil över tid, bidra till att det finansiella systemet är stabilt och effektivt och se till att det går att göra betalningar. Riksbanken ger också ut Sveriges sedlar och mynt.",,Sweden,,https://aihubtest-bucket.s3.eu-north-1.amazonaws.com/public/storage/images/21188/RB_Logo.svg,,,,1,my.ai.se,,75,2025-10-15 16:50:01,Authority & Agency,Accounting & Finance,,
1991,TechSeed,publicsector,https://www.techseed.se,,,Sweden,,,,,,1,my.ai.se,,50,2025-10-15 16:50:01,Information Technology,"IT & Software, Legal & Compliance, Management & Leadership, Operations, Security, Engineering, Innovation",,"Ecosystem & Partners, Execution, Technology, Vision & Strategy, Data"
1992,Almi AB,publicsector,https://www.almi.se,Det övergripande målet med verksamheten är att främja utveckling av konkurrenskraftiga små och medelstora företag och stimulera nyföretagandet i syfte att skapa tillväxt och förnyelse i svenskt näringsliv. Almi AB ägs av staten och är moderbolag i en koncern med 16 regionala dotterbolag och underkoncernen Almi Invest. De regionala dotterbolagen ägs till 51 procent av moderbolaget och till 49 procent av regionala ägare och erbjuder lån och affärsutveckling. Almi Invest AB ägs till 100 procent av moderbolaget och bedriver riskkapitalverksamhet.,,Sweden,,https://aihubtest-bucket.s3.eu-north-1.amazonaws.com/public/storage/images/16304/logo-bw.png,,,,1,my.ai.se,,80,2025-10-15 16:50:01,Financial,,,
1999,Dacapo,academia,,,,Sweden,,,,,,1,my.ai.se,,35,2025-10-15 16:50:01,"Financial, Automotive, Defense, Information Technology, Food & Farming, Manufacturing, Media","Research & Development, IT & Software, Customer Service & Support, Management & Leadership, Innovation",,"Usecases & Inspiration, Execution, Technology, Vision & Strategy, Data"
2006,Tekniska Verken i Kiruna AB,publicsector,https://www.tekniskaverkenikiruna.se/,,,Sweden,,https://aihubtest-bucket.s3.eu-north-1.amazonaws.com/public/storage/images/16566/images.jpg,,,,1,my.ai.se,,55,2025-10-15 16:50:01,Municipality,Urban Development,,Organization
2007,Qling.ai,startup,https://qling.ai/,"Qling.ai is an innovation startup in advanced Machine Learning technology for job searching. They are the most innovative company to date in Swedish recruitment market. Today they have automated 44,8% of all jobs in Sweden. Qling.ai is without a doubt the most effective platform to search jobs. They have it all covered. Some core functions: AI-apply ( With one click qling manage the whole process to apply for you ) Job Tracker ( track job searches, review rejections/interview requests ) Cv-creator ( free ) Mass AI-apply ( Apply 50+ jobs instantly ) Search among 40k+ ads. Automatically find fitting jobs for you. Qling.ai have been around since december 2023. While still unknown at large. They have been working tirelessly ever since. The team at Qling.ai is eager to release the new way of job searching by mid 2025.",,Sweden,,https://aihubtest-bucket.s3.eu-north-1.amazonaws.com/public/storage/images/16578/Qlingai-Main-Logo.png,,,,1,my.ai.se,,80,2025-10-15 16:50:01,,IT & Software,,Technology
2015,AI Utbildningscentrum (AIUC),startup,https://www.aiuc.se,"AI Utbildningscentrum (AI Education Center) makes artificial intelligence accessible to everyone. Our goal is to offer courses that provide individuals and organizations with the skills and insights they need in a rapidly changing, AI-driven world. Through our courses, we help both beginners and professionals understand, apply, and benefit from AI technologies. Our commitment to accessibility and quality is reflected in everything we do, from course content to support. With a strong focus on ethics, quality, and innovation, we strive to be a leading player in AI education. Learn more at www.aiuc.se",,Sweden,,https://aihubtest-bucket.s3.eu-north-1.amazonaws.com/public/storage/images/16751/aiuc-logo-format-1-to-1.jpg,Ampliro AB,,,1,my.ai.se,,90,2025-10-15 16:50:01,Education,Education & Learning,,Competence & Expertise
2021,Studiefrämjandet Uppsala Västmanland,ngo,,,,Sweden,,,,,,1,my.ai.se,,25,2025-10-15 16:50:01,,,,
2028,Nation.dev,supplier,https://nation.dev/,"Product & GenAI Engineers as a Service MVP to Full-Time Commitment Transparent, Flexible, Pay-As-You-Go Model Supporting Startups and Established Companies At Nation, we marry Product-Led development with Applicable AI, bringing solutions into real-world production. We to help businesses automate processes and build scalable MVPs that are ready for deployment. It’s about creating tangible results that make a meaningful impact on day-to-day operations. If you’re curious about how AI can truly drive efficiency and innovation, feel free to reach out. Always happy to share insights and ideas. Currently we are developing and Product-Led & GenAI platforms for the Swedish and Swiss industry.",,Sweden,,https://aihubtest-bucket.s3.eu-north-1.amazonaws.com/public/storage/images/16996/Square_Nation_Logo.jpg,,,,1,my.ai.se,,85,2025-10-15 16:50:01,"Financial, Research, Mining & Steel, Information Technology, Consulting & Advisory, Travel & Tourism, Manufacturing, Education, Media","Research & Development, IT & Software, Human Resources, Engineering, Innovation",,"Usecases & Inspiration, Ecosystem & Partners, Execution, Competence & Expertise, Culture & Mindset, Technology, Vision & Strategy, Data"
2030,Dagens Industri,media,https://www.di.se,,,Sweden,,https://aihubtest-bucket.s3.eu-north-1.amazonaws.com/public/storage/images/17028/Dagens-industri_RGB.png,,,,1,my.ai.se,,50,2025-10-15 16:50:01,Media,,,
2034,Configura AB,publicsector,https://www.configura.com,"Configura is a globally operating company with headquarters in Linköping, Sweden and commercial operations in Berlin, Germany; Grand Rapids, Michigan, USA; Cincinnati, Ohio, USA; Kuala Lumpur, Malaysia; and Tokyo, Japan. Configura creates Parametric Graphical Configuration (PGC) software solutions for leading, international companies. The technology is perfectly suited for industries that deal in configurable, complex products requiring space planning. As Configura’s software solutions become the standard for space planning, the scalability of our development platform offers new opportunities for partnering.",,Sweden,,https://aihubtest-bucket.s3.eu-north-1.amazonaws.com/public/storage/images/17148/CONFIGURA_Company_square.jpg,,,,1,my.ai.se,,80,2025-10-15 16:50:01,Information Technology,,,
2035,Mikrofonden Sverige / Sweden,ngo,https://mikrofonden.se/,"Mikrofonden Sverige - Microfund Sweden - is a cooperatively owned fund within social finance and impact investment. At Mikrofonden we work with supporting, training and increasing access to finance for the social economy sector - social enterprises, cooperatives and NGOs actively contributing the the Global Sustainability Development Goals. This sector is still often being excluded by mainstream finance actors. By investments and increasing access to finance we can help social economy-organisations start, develop, run projects and grow - increasing their impact to their target groups, local community and society at large. We are interested to get in touch with others using or developing cost efficient ways to utilize AI to help social economy-organisations and social finance-actors increase their impact.",,Sweden,,https://aihubtest-bucket.s3.eu-north-1.amazonaws.com/public/storage/images/17150/MF_logo_VastSVERIGE.png,,,,1,my.ai.se,,80,2025-10-15 16:50:01,Financial,,,
2036,"Socialförvaltningen, Stockholm stad",publicsector,https://start.stockholm/om-stockholms-stad/organisation/fackforvaltningar/socialforvaltningen/,"Socialförvaltningen, Stockholm stad",,Sweden,,,,,,1,my.ai.se,,50,2025-10-15 16:50:01,Authority & Agency,"IT & Software, Social Services, Innovation",,"Usecases & Inspiration, Competence & Expertise, Technology, Vision & Strategy"
2039,Oddly Robbie’s World,media,https://www.oddlyrobbie.org/,"Oddly Robbie's world is an ecosystem of constant disruption, challenging norms across technology, social justice, and lifestyle. Through personal reflections, Robbie intertwines his advocacy for LGBTQ+ rights, autism awareness, and sustainable living with cutting-edge technologies like AI and automation. He redefines traditional frameworks, such as Universal Basic Income (UBI) [oai_citation:6,Blog5.pdf](file-service://file-SUo9nLQlmrsTjwrEFdByQwRI), food security through ZeroWasteGPT [oai_citation:5,Blogs4.pdf](file-service://file-YOPwT05G7btgdsrYGn4BqGqt), and neurodiversity, critiquing the societal pressures to conform to ""normalcy"" [oai_citation:4,Blogs2.pdf](file-service://file-7rHSwCQvYuUNjXQhdLZNE782). At its core, Robbie's world acts as a force for organizational disruption by breaking down barriers—whether cultural, political, or technological. He tackles food scarcity through AI innovations and advocates for a future where human empathy coexists with technological advancements. His stories illustrate a life lived against the grain, transforming the personal into powerful, disruptive advocacy across global issues [oai_citation:3,autism stories .pdf](file-service://file-A1FBnh52i884Oj8uvG0EYVwc) [oai_citation:2,HarrisSupport.pdf](file-service://file-GqfkweA6Zy1Kttn6ItKT9UmD) [oai_citation:1,journy as a gay man.pdf](file-service://file-d7CkZXzrpBPTT4Htip0ZjfGj). In Robbie's world, disruption isn't just about technology—it's about forging paths toward inclusion, sustainability, and balance in a rapidly changing world.",,Sweden,,https://aihubtest-bucket.s3.eu-north-1.amazonaws.com/public/storage/images/17256/IMG_1802.jpeg,,,,1,my.ai.se,,85,2025-10-15 16:50:01,"Energy, Research, Food & Farming, Education, Media","Sustainability / Ethics / CSR, Environment, Innovation",,"Technology, Vision & Strategy"
2043,Saab AB,corporation,,"Saab serves the global market with world-leading products, services and solutions from military defence in all domains to civil security. Saab’s market offering is broad and consists of complex systems involving extensive research and development as well as services with a high degree of repetition. With operations on every continent, Saab continuously develops, adapts and improves new technology to meet customers’ changing needs.",,Sweden,,https://aihubtest-bucket.s3.eu-north-1.amazonaws.com/public/storage/images/17374/Saab_rgb_2270x720.png,,,,1,my.ai.se,,55,2025-10-15 16:50:01,Defense,,,
2044,GroupifyAI,academia,https://groupify.ai/,"GroupifyAI is a comprehensive AI tool and course directory designed to simplify the discovery and comparison of AI resources for enthusiasts and professionals. It offers a curated list of AI tools and courses across various categories, ensuring users find the best options for their needs. Key Features: Extensive AI Tool and Course Aggregator:Allows users to efficiently compare and find the best AI tools and courses in one place. User-Friendly Categorization:The platform categorizes tools and courses into AI productivity tools, video generators, text generators, image generators, art generators, audio generators, and more for easy navigation. Verified Tools and Courses:All resources are curated by editors to ensure quality and reliability. Exclusive Discounts and Deals:Offers competitive pricing with special discounts on select tools and courses. Personalized Recommendations:Provides tailored suggestions and community reviews to help users make informed decisions.",,Sweden,,https://aihubtest-bucket.s3.eu-north-1.amazonaws.com/public/storage/images/17420/Short-GroupifyAI-Logo.png,,,,1,my.ai.se,,85,2025-10-15 16:50:01,Education,"IT & Software, Education & Learning, Innovation",,"Technology, Vision & Strategy"
2048,Preem AB,corporation,,,,Sweden,,,,,,1,my.ai.se,,30,2025-10-15 16:50:01,Energy,,,
2052,Epachois Hospital Beds - Innovation,corporation,,"Discover a new standard in home healthcare with our selection of electric and hospital beds. Designed for ultimate comfort and functionality, our beds enhance daily living by providing easy adjustability and superior support. Whether you need enhanced mobility or specific care features, our range offers innovative solutions that bring professional-grade quality to your home, ensuring both patients and caregivers experience a higher level of comfort and convenience. https://www.epachois.com/",,Sweden,,,,,,1,my.ai.se,,50,2025-10-15 16:50:01,Healthcare & Life Sciences,,,
2054,Studieförbundet Vuxenskolan Väst,organizer,,,,Sweden,,https://aihubtest-bucket.s3.eu-north-1.amazonaws.com/public/storage/images/17545/SV-logotype-på-grön-bakgrund.png,,,,1,my.ai.se,,40,2025-10-15 16:50:01,Education,Education & Learning,,Culture & Mindset
2055,flux 1.1 Pro AI,startup,https://flux1-1.ai/,"Flux 1.1 Pro AI is an AI image generation platform powered by Flux Pro 1.1, designed to enhance the creative process with faster generation times and more accurate prompt adherence. With six times the efficiency of its predecessor, Flux Pro 1.1 supports high-resolution image outputs and can be applied across various creative and development scenarios. Whether you’re a developer or an artist, Flux1-1.ai provides a fast and reliable AI image generation experience",,Sweden,,https://aihubtest-bucket.s3.eu-north-1.amazonaws.com/public/storage/images/17555/logo.png,,,,1,my.ai.se,,75,2025-10-15 16:50:01,Media,IT & Software,,Technology
2056,AI for Social Progress,ngo,https://ai4sp.org,"At AI4SP, we see beyond the AI buzz. While the world gets caught up in the hype, we focus on harnessing AI’s transformative power in tangible, practical, and capital-efficient ways for daily operations. We demystify Generative AI for Small and Mid-Size Organizations, Academia, and Nonprofits, ensuring they can tap into AI’s vast potential right now.",,Sweden,,https://aihubtest-bucket.s3.eu-north-1.amazonaws.com/public/storage/images/17589/AI4SP.org-Icon-with-tagline-1500x1500-1.jpg,,,,1,my.ai.se,,70,2025-10-15 16:50:01,"Civil Society, Education",,,
2072,Chatpdffree.com,startup,https://chatpdffree.com,Chat PDF Free is an organization that developes software tools. The primary one being an AI online tool that helps users engage with their pdf documents with the help of AI.,,Sweden,,https://aihubtest-bucket.s3.eu-north-1.amazonaws.com/public/storage/images/17994/PdfChat_Icon-removebg-preview.png,,,,1,my.ai.se,,65,2025-10-15 16:50:01,Consulting & Advisory,IT & Software,,Technology
2073,European Working Group of Competent Authorities on AI,publicsector,,"The European Working Group of Competent Authorities in AI was founded in 2022 and consists of authorities and ministries from EU member states, ENISA, UNESCO, EU Comission / EU AI Office and DG Connect. The purpose of the group is to analyse, plan, develop competence and prepare for AI supervision according to the EU AI act. The group holds monthly meetings and two physical meetings per year.",,Sweden,,https://aihubtest-bucket.s3.eu-north-1.amazonaws.com/public/storage/images/18003/EU-WG-CA-on-AI_2.GIF,,,,1,my.ai.se,,60,2025-10-15 16:50:01,Authority & Agency,Legal & Compliance,,Competence & Expertise
2078,Four PR,corporation,https://www.fourpr.se,,,Sweden,,,,,,1,my.ai.se,,45,2025-10-15 16:50:01,Consulting & Advisory,,,
2079,Artificial Engineering,supplier,https://artificial.engineering,"Artificial Engineering is an innovative European startup in the field of artificial intelligence. We have as corporate objectives the conception, analysis and definition of requirements, design, prototyping, research, development, testing, marketing, quality control, maintenance and management, of any applications based, even partially, on artificial intelligence algorithms and any related support hardware and software applications.",,Sweden,,https://aihubtest-bucket.s3.eu-north-1.amazonaws.com/public/storage/images/18081/v49_coat_bow_AE_square_w.png,,,,1,my.ai.se,,75,2025-10-15 16:50:01,"Financial, Automotive, Research, Defense, Healthcare & Life Sciences, Information Technology, Consulting & Advisory, Travel & Tourism, Space, Manufacturing, Transportation & Logistics, Media",Research & Development,,Competence & Expertise
2080,Domstolsverket,publicsector,https://www.domstol.se/domstolsverket/,"Domstolsverket är en statlig myndighet som har till uppgift att stödja och serva domstolar, nämnder och myndigheter inom Sveriges Domstolar. Domstolsverkets huvudkontor ligger i Jönköping, lokalkontoren finns i Stockholm, Göteborg, Malmö och Umeå.",,Sweden,,https://aihubtest-bucket.s3.eu-north-1.amazonaws.com/public/storage/images/18110/nnKLQYux-350x350.jpeg,,,,1,my.ai.se,,70,2025-10-15 16:50:01,Authority & Agency,,,
2085,"Stadsledningskontoret, Stockholm stad",publicsector,,,,Sweden,,,,,,1,my.ai.se,,35,2025-10-15 16:50:01,Municipality,Legal & Compliance,,
2086,Aposmart,corporation,https://www.aposmart.se/,"Utvecklar jämförelsetjänster med känsla för kundens behov. Analys av priser, produkter, marknader och lagerstatus.",,Sweden,,https://aihubtest-bucket.s3.eu-north-1.amazonaws.com/public/storage/images/18220/aposmart.png,,,,1,my.ai.se,,60,2025-10-15 16:50:01,Healthcare & Life Sciences,,,Usecases & Inspiration
2088,Leksands folkhögskola/SkillStation,academia,https://skillstation.se,"SkillStation är en ny slags utbildningsmiljö som ägs av Leksands folkhögskola med stöd av Allmänna Arvsfonden. SkillStation riktar sig till två målgrupper: unga personer och seniorer. Här kan deltagarna, med hjälp av AI och handledning, få möjlighet att utveckla sina unika intressen och färdigheter. Kort sagt, en utbildning där man kan lära sig ""hur man lär sig"". SkillStation är inhuset på Leksands folkhögskola och är ett riksrekryterande projekt.",,Sweden,,https://aihubtest-bucket.s3.eu-north-1.amazonaws.com/public/storage/images/18319/Untitled-design-2.png,,,,1,my.ai.se,,75,2025-10-15 16:50:01,Education,Innovation,,Technology
2092,Malmö Stad - HVOF,publicsector,https://malmo.se/Jobb/Verksamhet/Halsa--vard--och-omsorgsforvaltningen.html,"Välkommen till hälsa-, vård- och omsorgs­förvaltningen Vår förvaltning ansvarar för det som i dagligt tal kallas äldreomsorg, men som rymmer så mycket mer. Hos oss bidrar du till äldres trygghet, hälsa och möjlighet till ett rikt liv. Dessutom sätter vi dig som medarbetare i centrum.",,Sweden,,https://aihubtest-bucket.s3.eu-north-1.amazonaws.com/public/storage/images/18499/Malmostad_logo_RGB_600px_300dpi.jpg,,,,1,my.ai.se,,70,2025-10-15 16:50:01,Municipality,,,
2093,M10 AI,ngo,https://linktr.ee/m10ai,,,Sweden,,https://aihubtest-bucket.s3.eu-north-1.amazonaws.com/public/storage/images/18520/M1.png,,,,1,my.ai.se,,50,2025-10-15 16:50:01,Education,,,
2098,Övik Energi AB,publicsector,,,,Sweden,,,,,,1,my.ai.se,,30,2025-10-15 16:50:01,Energy,,,
2101,Doings by House of Impact AB,startup,https://doings.se,"We're a consultant agency, developing culture, structure and the right behaviors for sustainable development.",,Sweden,,https://aihubtest-bucket.s3.eu-north-1.amazonaws.com/public/storage/images/18660/doingslogga.jpg,,,,1,my.ai.se,,65,2025-10-15 16:50:01,Consulting & Advisory,"Sustainability / Ethics / CSR, Management & Leadership, Marketing & Communications, Human Resources, Education & Learning, Innovation",,"Usecases & Inspiration, Ecosystem & Partners, Execution, Competence & Expertise, Culture & Mindset, Organization, Vision & Strategy"
